Date,Entry
2024-04-01 00:00:00,"The day started like any other. Woke up, had my usual coffee, and went about my routine. Work was neither too stressful nor too exciting—just another regular day. In the evening, I played with my friends at 5 PM, which was a nice break from the usual routine. Later, after dinner and some TV, I hit the gym at 10 PM for a workout. Finished the day by scrolling through social media before heading to bed."
2024-04-02 00:00:00,"Met an old friend unexpectedly at a cafe. We hadn’t talked in years, but it felt like no time had passed. We laughed about old times, shared updates about life, and left with a warmth that carried me through the rest of the day. It reminded me how little moments like these can be so uplifting. Earlier in the evening, I played with my friends at 5 PM, which was a fun break. Later, I went to the gym at 10 PM for a workout before wrapping up the day."
2024-04-03 00:00:00,"Received a random package at my doorstep—it was a book I had pre-ordered months ago and completely forgotten about. That small but pleasant surprise brought a smile to my face. I spent the evening flipping through its pages, already hooked by the first few chapters. Earlier, I played with my friends at 5 PM, which was a fun break, and later, I went to the gym at 10 PM for a workout before wrapping up the day."
2024-04-04 00:00:00,"Saw an old picture today, and it brought back memories of someone I don’t talk to anymore. It made me wonder how things could have been different. I carried that heaviness with me all day, replaying past conversations in my mind and feeling that bittersweet nostalgia settle in my chest. Earlier, I played with my friends at 5 PM, which was a fun break, and later, I went to the gym at 10 PM for a workout before wrapping up the day."
2024-04-05 00:00:00,"Had an amazing workout today—one of those days where everything just clicks. I felt strong, energized, and proud of myself for pushing through. There's something so satisfying about feeling progress, both physically and mentally. Earlier, I played with my friends at 5 PM, which was a fun break. Ended the night with a good meal, feeling accomplished and happy."
2024-04-06 00:00:00,"Woke up from a nightmare, the kind that lingers even after you realize it wasn’t real. My heart was still pounding, and it took a while to shake the uneasy feeling. Even the shadows in my room felt eerie. I distracted myself with a podcast until I calmed down enough to fall asleep again. Earlier, I played with my friends at 5 PM, which was a fun break, and later, I went to the gym at 10 PM for a workout before wrapping up the day."
2024-04-07 00:00:00,"Saw someone littering at the park. It irked me more than it should have. Just the casual disregard for the environment left a bad taste in my mouth. I picked up the trash myself, but it made me wonder—how hard is it to just do the right thing? It’s frustrating seeing such carelessness. Earlier, I played with my friends at 5 PM, which was a fun break, and later, I went to the gym at 10 PM for a workout before wrapping up the day."
2024-04-08 00:00:00,"Nothing eventful today. Just a regular cycle of work, eat, and sleep. It’s weird how some days just blur into the next without anything particularly exciting or upsetting happening. Maybe tomorrow will bring something different, but for now, today just existed in the background of my life. Earlier, I played with my friends at 5 PM, which was a fun break, and later, I went to the gym at 10 PM for a workout before wrapping up the day."
2024-04-09 00:00:00,"Someone cut me off in traffic and had the audacity to honk at me. That irrational burst of anger stayed with me longer than I’d like to admit. I replayed the moment in my head, thinking of all the witty comebacks I could have said. It’s funny how small things can feel so big in the moment. Later, I went to the gym at 10 PM for a workout before wrapping up the day."
2024-04-10 00:00:00,"Tried a new dish today, and it was fantastic! There’s something about good food that instantly lifts the mood. I savored every bite, already thinking about when I could have it again. Cooking or ordering food isn’t just about eating; it’s about the experience of discovering something new. Later, I went to the gym at 10 PM for a workout before wrapping up the day."
2024-04-11 00:00:00,"Got a message from a distant cousin out of nowhere. We haven’t spoken in years, and it was nice catching up. Life has taken us in such different directions, yet we still found common ground. It’s strange how time passes, but some connections never really fade completely. Earlier, I played with my friends at 5 PM, which was a fun break, and later, I went to the gym at 10 PM for a workout before wrapping up the day."
2024-04-12 00:00:00,"Felt a little lonely today. Not sure why. Maybe it’s just one of those days where everything feels a little heavier. I tried distracting myself with work and entertainment, but the feeling lingered in the background. Some days are just like that, and I guess that’s okay. Earlier, I played with my friends at 5 PM, which was a fun break, and later, I went to the gym at 10 PM for a workout before wrapping up the day."
2024-04-13 00:00:00,"Got through work, finished some errands, and wrapped up the day with a movie. Nothing particularly special, but not bad either. These kinds of days may not be memorable, but they make up most of life. And in a way, that’s comforting—just moving forward, one day at a time. Earlier, I played with my friends at 5 PM, which was a fun break, and later, I went to the gym at 10 PM for a workout before wrapping up the day."
2024-04-14 00:00:00,"A random dog ran up to me while I was out for a walk. Tail wagging, full of energy. That brief interaction brightened my whole day. Animals have this pure joy about them that’s so infectious. It made me wish I had a dog of my own. Earlier, I played with my friends at 5 PM, which was a fun break, and later, I went to the gym at 10 PM for a workout before wrapping up the day."
2024-04-15 00:00:00,"Had to walk through a poorly lit street at night. Heart raced a little faster than usual, even though nothing happened. Funny how the mind creates scenarios. The sound of footsteps behind me didn’t help, even though it was probably just another person walking home like me. Earlier, I played with my friends at 5 PM, which was a fun break, and later, I went to the gym at 10 PM for a workout before wrapping up the day."
2024-04-16 00:00:00,"Had some street food that didn’t sit well with me. Regretted my choices almost instantly. My stomach was upset all night, and I kept scolding myself for not being more careful. Lesson learned—maybe I should stick to safer options next time. Earlier, I played with my friends at 5 PM, which was a fun break, and later, I went to the gym at 10 PM for a workout before wrapping up the day."
2024-04-17 00:00:00,"Meetings, emails, and the usual work chaos. Nothing too dramatic, just the usual grind. Some days are just meant to be productive rather than exciting, and that’s okay. Checked a lot off my to-do list, so at least there’s some satisfaction in that. Later, I went to the gym at 10 PM for a workout before wrapping up the day."
2024-04-18 00:00:00,"Got into a small argument with a coworker. It wasn’t a big deal, but I hate when misunderstandings escalate unnecessarily. Spent the rest of the day replaying the conversation in my head, wishing I had handled it better. I guess I’ll have to clear things up tomorrow. Earlier, I played with my friends at 5 PM, which was a fun break, and later, I went to the gym at 10 PM for a workout before wrapping up the day."
2024-04-19 00:00:00,"Listened to an old song that brought back such good memories. Amazing how music can instantly transport you back to another time. I closed my eyes and let it take me back to simpler days, a nice escape from the present for a little while. Earlier, I played with my friends at 5 PM, which was a fun break, and later, I went to the gym at 10 PM for a workout before wrapping up the day."
2024-04-20 00:00:00,"Found some extra cash in my jacket pocket. Completely unexpected but definitely welcomed! It’s not a lot, but it’s funny how something so small can make a difference in my mood. A lucky little discovery. Earlier, I played with my friends at 5 PM, which was a fun break, and later, I went to the gym at 10 PM for a workout before wrapping up the day."
2024-04-21 00:00:00,"Missed someone deeply today. Certain places and memories just bring it all back. I tried to stay busy, but the feeling stayed with me. Some people leave, but the memories never do. Maybe that’s both the blessing and the curse of having loved and lost. Earlier, I played with my friends at 5 PM, which was a fun break, and later, I went to the gym at 10 PM for a workout before wrapping up the day."
2024-04-22 00:00:00,"Work was steady, and the day passed by without much excitement. I did a little reading in the evening, which helped me unwind. Not every day has to be an adventure—sometimes just having a calm, uneventful day is a good thing too. Earlier, I played with my friends at 5 PM, which was a fun break, and later, I went to the gym at 10 PM for a workout before wrapping up the day."
2024-04-23 00:00:00,"Caught up with an old hobby today—painting. It’s been years since I picked up a brush, and at first, I felt rusty. But as the colors blended on the canvas, I lost track of time. There’s something freeing about creating without worrying about perfection. I think I’ll try to do this more often. Earlier, I played with my friends at 5 PM, which was a fun break, and later, I went to the gym at 10 PM for a workout before wrapping up the day."
2024-04-24 00:00:00,"Had a close call with a reckless driver today. One second, everything was normal, and the next, a car swerved dangerously close to mine. My heart pounded long after the moment passed. It’s scary how things can change in an instant. A reminder to always stay alert and appreciate the calm moments. Earlier, I played with my friends at 5 PM, which was a fun break, and later, I went to the gym at 10 PM for a workout before wrapping up the day."
2024-04-25 00:00:00,"Unexpectedly got a day off! Instead of wasting it, I decided to make it count. Spent the morning at a cozy café, just sipping coffee and watching people go about their day. Then, I took a spontaneous walk in the park. No plans, no deadlines—just a day to breathe. It felt refreshing. Earlier, I played with my friends at 5 PM, which was a fun break, and later, I went to the gym at 10 PM for a workout before wrapping up the day."
2024-04-26 00:00:00,"Landed in Japan today! The moment I stepped out of the airport, I felt a rush of excitement. Tokyo is alive with energy—neon lights, bustling streets, and an endless flow of people. Checked into my hotel and took a quick walk through Shinjuku. The sheer scale of the city is overwhelming but exhilarating. Can’t wait to explore more! "
2024-04-27 00:00:00,"Took the Shinkansen to Kyoto, and it felt like stepping into another world. The contrast between modern Tokyo and Kyoto’s historic charm is incredible. Visited the Fushimi Inari Shrine with its famous torii gates. The peacefulness of the temples, the sound of rustling leaves—it all felt surreal. Ended the day with matcha and traditional sweets."
2024-04-28 00:00:00,"Back in Tokyo and finally saw the famous Shibuya Crossing. The sheer number of people moving in perfect rhythm was mesmerizing. Visited Akihabara, the paradise for anime and tech lovers, and spent way too much time in arcades. Had the best ramen of my life at a tiny shop hidden in an alley. Japan keeps surprising me!"
2024-04-29 00:00:00,"My last day here, and I’m already wishing I had more time. Walked through Asakusa, took in the view from Tokyo Tower, and made one last stop for sushi. Japan has been an unforgettable experience—from the kindness of strangers to the smallest details in everyday life. Leaving with a heart full of memories."
2024-04-30 00:00:00,"It’s funny looking back at these last 30 days. So many small moments, so many emotions. Life really is a mix of everything, isn’t it? Some days were great, some weren’t, but they all mattered in their own way. I wonder what the next month will bring."
